<?xml version="1.0" encoding="utf-8"?>
<xs:schema elementFormDefault="qualified" xmlns:xs="http://www.w3.org/2001/XMLSchema"
targetNamespace="https://www.uniovi.es" xmlns="https://www.uniovi.es">
  <xs:element name="rutas">
    <xs:complexType>
      <xs:sequence>
        <xs:element minOccurs="3" maxOccurs="unbounded" ref="ruta" />
      </xs:sequence>
    </xs:complexType>
  </xs:element>
  <xs:element name="ruta">
    <xs:complexType>
      <xs:sequence>
        <xs:element ref="nombre" />
        <xs:element ref="tipo" />
        <xs:element ref="medio" />
        <xs:element minOccurs="0" maxOccurs="1" ref="fecha_inicio" />
        <xs:element minOccurs="0" maxOccurs="1" ref="hora_inicio" />
        <xs:element ref="duracion" />
        <xs:element ref="agencia" />
        <xs:element ref="descripcion" />
        <xs:element ref="personas_adecuadas" />
        <xs:element ref="inicio" />
        <xs:element ref="referencias" />
        <xs:element ref="recomendacion" />
        <xs:element ref="hitos" />
      </xs:sequence>
    </xs:complexType>
  </xs:element>
  <xs:element name="nombre" type="xs:string" />
  <xs:element name="tipo" type="xs:string" />
  <xs:element name="medio" type="xs:string" />
  <xs:element name="fecha_inicio" type="xs:date" />
  <xs:element name="hora_inicio" type="xs:time" />
  <xs:element name="duracion" type="xs:duration" />
  <xs:element name="agencia" type="xs:string" />
  <xs:element name="descripcion" type="xs:string" />
  <xs:element name="personas_adecuadas" type="xs:string" />
  <xs:element name="inicio">
    <xs:complexType>
      <xs:sequence>
        <xs:element ref="lugar" />
        <xs:element ref="direccion" />
        <xs:element ref="coordenadas" />
      </xs:sequence>
    </xs:complexType>
  </xs:element>
  <xs:element name="lugar" type="xs:string" />
  <xs:element name="direccion" type="xs:string" />
  <xs:element name="coordenadas">
    <xs:complexType>
      <xs:sequence>
        <xs:element ref="longitud" />
        <xs:element ref="latitud" />
        <xs:element ref="altitud" />
      </xs:sequence>
    </xs:complexType>
  </xs:element>
  <xs:element name="longitud" type="xs:float" />
  <xs:element name="latitud" type="xs:float" />
  <xs:element name="altitud" type="xs:float" />
  <xs:element name="referencias">
    <xs:complexType>
      <xs:sequence>
        <xs:element minOccurs="3" maxOccurs="unbounded" ref="referencia" />
      </xs:sequence>
    </xs:complexType>
  </xs:element>
  <xs:element name="referencia">
    <xs:complexType>
      <xs:sequence>
        <xs:element ref="titulo" />
        <xs:element ref="bibliografia" />
      </xs:sequence>
    </xs:complexType>
  </xs:element>
  <xs:element name="titulo" type="xs:string" />
  <xs:element name="bibliografia" type="xs:string" />
  <xs:element name="recomendacion">
    <xs:simpleType>
      <xs:restriction base="xs:integer">
        <xs:minInclusive value="0" />
        <xs:maxInclusive value="10" />
      </xs:restriction>
    </xs:simpleType>
  </xs:element>

  <xs:element name="hitos">
    <xs:complexType>
      <xs:sequence>
        <xs:element minOccurs="3" maxOccurs="unbounded" ref="hito" />
      </xs:sequence>
    </xs:complexType>
  </xs:element>
  <xs:element name="hito">
    <xs:complexType>
      <xs:sequence>
        <xs:element ref="nombre" />
        <xs:element ref="descripcion" />
        <xs:element ref="coordenadas" />
        <xs:element ref="distancia" />
        <xs:element ref="galeria_fotos" />
        <xs:element minOccurs="0" maxOccurs="1" ref="galeria_videos" />
      </xs:sequence>
    </xs:complexType>
  </xs:element>
  <xs:element name="distancia">
    <xs:complexType>
      <xs:simpleContent>
        <xs:extension base="xs:float">
          <xs:attribute name="unidades" type="xs:string" use="required" />
        </xs:extension>
      </xs:simpleContent>
    </xs:complexType>
  </xs:element>
  <xs:element name="galeria_fotos">
    <xs:complexType>
      <xs:sequence>
        <xs:element minOccurs="1" maxOccurs="5" ref="foto" />
      </xs:sequence>
    </xs:complexType>
  </xs:element>
  <xs:element name="foto" type="xs:string" />
  <xs:element name="galeria_videos">
    <xs:complexType>
      <xs:sequence>
        <xs:element minOccurs="0" maxOccurs="3" ref="video" />
      </xs:sequence>
    </xs:complexType>
  </xs:element>
  <xs:element name="video" type="xs:string" />
</xs:schema>